기업명,채용 직무/분야,주요 업무,지원 자격 및 우대사항,근무 조건,모집 기간,지원 방법,기타 사항
㈜모멘티,백엔드 개발자 (신입),"웹사이트 및 어플리케이션 백엔드 개발, 서비스 운영 유지에 필요한 관리 시스템 구축","지원 자격: 신입, 학력 무관,우대 사항: AWS 경험자, 컴퓨터/시스템공학 전공자, 해당 직무 인턴 경력 또는 근무 경험자, 에이전시 근무 경험자","정규직, 근무지: 서울 강남구 논현로105길 11-3 (역삼동)","시작일: 2024.11.01 (금), 마감일: 2024.12.27 (금)",잡코리아 이력서 양식을 통한 온라인 지원,"서류전형 > 1차 면접 > 최종 합격, 면접 일정은 추후 통보, 허위사실 발견 시 채용 취소 가능"
㈜에스에이치엘에이비,"C#, 파이썬 개발자","소프트웨어 개발 및 유지보수, C# 및 Python을 활용한 프로그램 개발, 고객사 요구사항 분석 및 대응","지원 자격: 경력 무관, 학력 무관, C# 및 Python 활용 능력,우대 사항: 관련 전공자, 유관 업무 경험자, 영어 가능자","정규직 (수습 3개월), 근무지: 서울시 강남구 테헤란로87길 36 도심공항타워 1207호, 주 5일 (월",상시 채용,잡코리아 이력서 양식을 통한 온라인 지원,"4대보험 가입: 국민연금, 건강보험, 고용보험, 산재보험, 서류전형 결과는 1개월 이내 안내, 국가보훈 취업지원 대상자 우대, 서류전형 이후 일정은 합격자에 한해 개별 안내"
기아㈜,IT 전문가,"IT 시스템 개발 및 운영, 데이터 분석 및 관리, 디지털 전환 프로젝트 참여","지원 자격: 경력, 학력 무관,우대 사항: 영어 가능자, 컴퓨터 활용 능력 우수자, 유관 업무 경험자, 관련 학과 전공자, 관련 자격증 보유자","정규직, 근무지: 서울 서초구","시작일: 2024.11.15 (금), 마감일: 2024.12.02 (월)",홈페이지를 통한 온라인 지원,"서류전형 결과는 1개월 이내 안내, 국가보훈 취업지원 대상자 우대, 전형 일정은 변동될 수 있으며, 합격자에 한해 개별 안내"
㈜사이냅소프트,[2024년 신입·경력] 솔루션 사업본부,"C/C++ 기반의 문서처리 솔루션 개발, TensorFlow 및 PyTorch를 이용한 인공지능 솔루션 개발, Web 환경 기반의 RestAPI 서비스 및 솔루션 개발, AWS 등의 클라우드 인프라 환경에서 동작하는 서비스 개발","지원 자격: 새로운 기술에 대한 호기심이 많고 학습을 즐기는 분, 사이냅소프트와 제품을 함께 발전시키고 싶은 분, Java, JSP, JavaScript, HTML/CSS, C/C++, Python 언어 중 1개 이상 사용 가능자,우대 사항: 관련 전공자, 유관 업무 경험자, 관련 자격증 보유자","정규직 (수습 3개월), 근무지: 서울시 강서구, 주 5일 (월","시작일: 2024.11.27 (수), 마감일: 2024.12.04 (수)",홈페이지를 통한 온라인 지원,"서류전형 결과는 1개월 이내 안내, 국가보훈 취업지원 대상자 우대, 서류전형 이후 일정은 합격자에 한해 개별 안내"
주식회사 빗썸,2024 빗썸 전직군 채용,각 부문별 업무 수행 (상세 내용은 채용 공고 참조),"지원 자격: 경력 무관, 학력 무관,우대 사항: 국가유공자, 장애인, 영어 가능자, 보훈 대상자, 문서 작성 우수자, 포토샵 능숙자","정규직 (수습 3개월) 및 계약직 (분야별 상이), 근무지: 서울시 강남구 등",상시 채용 (채용 완료 시 조기 마감),홈페이지를 통한 온라인 지원,"서류전형 결과는 1개월 이내 안내, 국가보훈 취업지원 대상자 우대, 서류전형 이후 일정은 합격자에 한해 개별 안내"
,,,,,,,
