기업명,채용 직무/분야,주요 업무,지원 자격 및 우대사항,근무 조건,모집 기간,지원 방법,기타 사항
퀴네앤드나겔,물류 운영 및 관리,"국제 물류 운송 서비스 제공, 해운 및 항공 화물 운송, 창고 운영 및 관리","지원 자격: 관련 분야 경력자 우대, 영어 능통자, 물류 및 SCM 관련 전공자 우대","정규직, 근무지: 서울 영등포구 의사당대로 82",상시 채용,잡코리아를 통한 온라인 지원,"서류전형 결과는 1개월 이내 안내, 국가보훈 취업지원 대상자 우대, 서류전형 이후 일정은 합격자에 한해 개별 안내"
엘에스이모빌리티솔루션,"전기장비 제조 (EV Relay, 산업용 Relay)","전기회로 개폐 및 보호장치 제조, EV 및 산업용 릴레이 생산","지원 자격: 관련 분야 경력자 우대, 전기/전자공학 전공자 우대","정규직, 근무지: 충북 청주시 흥덕구 백봉로 95",상시 채용,잡코리아를 통한 온라인 지원,"서류전형 결과는 1개월 이내 안내, 국가보훈 취업지원 대상자 우대, 서류전형 이후 일정은 합격자에 한해 개별 안내"
사이냅소프트,[2024년 신입·경력] 솔루션 사업본부,"솔루션 사업본부 내 다양한 프로젝트 수행, 고객사와의 커뮤니케이션 및 요구사항 분석, 솔루션 개발 및 유지보수","지원 자격: 신입 또는 경력, 학력 무관,우대 사항: AWS, JAVA, MySQL, Node.js, Python, React, Spring, TypeScript, Figma, C/C++ 등 관련 기술 스킬 보유자","정규직 (수습 3개월), 근무지: 서울시 강서구","시작일: 2024.11.27 (수), 마감일: 2024.12.04 (수)",홈페이지를 통한 온라인 지원,"서류전형 결과는 1개월 이내 안내, 국가보훈 취업지원 대상자 우대, 서류전형 이후 일정은 합격자에 한해 개별 안내"
포시즌스호텔서울,경영지원 각 부문 신입 및 경력,"케이터링 세일즈 컨퍼런스 서비스 매니저, 식음료부 세일즈 매니저, 웨딩 매니저, 세일즈 코디네이터 등 각 부문별 업무 수행","지원 자격: 신입 또는 경력, 학력 무관,우대 사항: 영어 가능자, 관련 학과 전공자, 유관 업무 경력자","정규직 (수습 3개월) 또는 계약직 (근무기간 2년, 정규직 전환 가능), 근무지: 서울시 종로구","시작일: 2024.11.20 (수), 마감일: 2025.01.19 (일)",잡코리아 이력서 양식을 통한 온라인 지원,"서류전형 결과는 1개월 이내 안내, 국가보훈 취업지원 대상자 우대, 서류전형 이후 일정은 합격자에 한해 개별 안내"
현대트랜시스,계약직 모집,상세 업무 내용은 공고에 미기재,"지원 자격: 경력 무관, 고졸 이상,우대 사항: 장애인, 운전 가능자, 유관 업무 경험자(인턴·알바), 보훈 대상자, 유관 업무 경력자, 지게차운전기능사 자격증 보유자","계약직, 급여: 회사 내규에 따름 (면접 후 결정), 근무지: 경기도 화성시","시작일: 2024.11.26 (화), 마감일: 2024.12.02 (월)",홈페이지를 통한 온라인 지원,"4대보험 가입: 국민연금, 건강보험, 고용보험, 산재보험"
,,,,,,,
