기업명,채용 직무/분야,주요 업무,지원 자격 및 우대사항,근무 조건,모집 기간,지원 방법,기타 사항
다이닝브랜즈그룹,2024 대졸 신입사원 채용,"가맹SV, 구매, 디자인, 마케팅, 메뉴개발, 인사(HRD), 재무, 해외사업, IT 등 각 부문별 업무 수행","지원 자격: 경력 무관, 대졸 이상 (졸업예정자 가능), 운전면허 소지자,우대 사항: 장애인, 보훈대상자, 관련 학과 전공자, 관련 자격증 보유자","정규직, 근무지: 서울 송파구 및 전국","시작일: 2024.11.26 (화), 마감일: 2024.12.09 (월)",자사 지원서 양식을 통한 온라인 지원,"4대보험 가입: 국민연금, 건강보험, 고용보험, 산재보험, 서류전형 결과는 1개월 이내 안내, 서류전형 이후 일정은 합격자에 한해 개별 안내"
포시즌스호텔서울,경영지원 각 부문 신입 및 경력 채용,"케이터링 세일즈 컨퍼런스 서비스 매니저, 식음료부 세일즈 매니저, 웨딩 매니저, 세일즈 코디네이터 등 각 부문별 업무 수행","지원 자격: 신입 또는 경력, 학력 무관,우대 사항: 영어 가능자, 영어 능통자(원어민 수준), 관련 학과 전공자, 유관 업무 경력자","정규직 (수습 3개월) 또는 계약직 (근무기간 2년, 정규직 전환 가능), 근무지: 서울시 종로구","시작일: 2024.11.20 (수), 마감일: 2025.01.19 (일)",잡코리아 이력서 양식을 통한 온라인 지원,"서류전형 결과는 1개월 이내 안내, 서류 합격자에 한해 일정 개별 통보, 지원자 이해를 돕기 위해 직위 표현 사용, 포시즌스 내부 규정에 의한 Job Title(Position) 사용"
롯데마트,신선영업관리 JA Grade 신입사원 (채용연계형 인턴),"신선식품 영업관리, 매출 및 재고 관리, 고객 서비스 등","지원 자격: 고등학교 졸업자 및 전문학사 학위 보유자, 신입·경력 무관,우대 사항: 장애인, 보훈대상자, 관련 자격증 보유자, 유관업무 경력자","인턴 (근무기간 2개월, 정규직 전환 가능), 근무지: 서울 송파구 및 전국, 급여: 회사 내규에 따름","시작일: 2024.11.21 (목), 마감일: 2024.12.02 (월) 23:00",홈페이지를 통한 온라인 지원,"4대보험 가입: 국민연금, 건강보험, 고용보험, 산재보험, 마감일은 기업 사정에 따라 조기 마감 또는 변경될 수 있음"
삼성화재서비스손해사정,"인바운드 상담, 고객창구 (텔러)","고객 상담 및 창구 업무, 보험 관련 문의 응대, 고객 서비스 제공","지원 자격: 경력 무관, 학력 무관,우대 사항: 국가유공자, 장애인, 영어 가능자, 일본어 가능자, 중국어 가능자, 유관 업무 경험자(인턴·알바), 유관 업무 경력자","계약직 (근무기간 6개월, 정규직 전환 가능), 연봉 3,200만 원 이상, 근무지: 서울시 양천구, 서울 전지역, 강북구, 강서구, 인천 전지역, 부평구, 대구 전지역, 광주 전지역, 경기도 부천시, 구리시, 전북 전주시 덕진구, 전주시 완산구, 경남 창원시 마산합포구, 창원시 마산회원구, 창원시 의창구, 주 5일 (월","시작일: 2024.11.25 (월), 마감일: 2024.12.15 (일)",홈페이지를 통한 온라인 지원,"4대보험 가입: 국민연금, 건강보험, 고용보험, 산재보험, 서류전형 결과는 1개월 이내 안내, 국가보훈 취업지원 대상자 우대, 서류전형 이후 일정은 합격자에 한해 개별 안내"
,,,,,,,
